{
  "skill_id": "GWS-handoff-and-follow-through",
  "editorial_version": "0.2.0",
  "status": "release-candidate",
  "runtime_authority": false,
  "contract_status": "editorial-schema-1.0.0-and-shared-contract-1.0.0-validated",
  "title_th": "ส่งต่องานและติดตามความรับผิดชอบ",
  "title_en": "Handoff and follow through",
  "family_id": "deliver-and-improve",
  "workplace_situation": "งานเปลี่ยนผู้ทำ/กะ/ทีม หรือมีข้อตกลงที่ต้องตามต่อ",
  "purpose": "ส่งต่องานและติดตามความรับผิดชอบจากหลักฐานในเหตุการณ์ เพื่อเลือกการกระทำถัดไปที่เหมาะกับบริบท",
  "scope": {
    "applicable_roles": [
      "contributor",
      "manager"
    ],
    "required_managerial_authority": false,
    "work_contexts": [
      "desk",
      "frontline"
    ],
    "boundary_conditions": [
      "ใช้เฉพาะงานและข้อมูลที่ผู้ใช้มีสิทธิ",
      "ไม่แทนขั้นตอนองค์กรหรือความรู้เฉพาะวิชาชีพ",
      "เหตุการณ์คุกคาม ความปลอดภัยหรือความเสี่ยงสูงต้องใช้ช่องทางที่เหมาะสมก่อนกิจกรรมฝึก"
    ]
  },
  "observable_actions": [
    {
      "action_id": "A1",
      "action": "ระบุสถานะงาน สิ่งที่ทำแล้ว สิ่งที่ยังค้างและข้อมูลที่ผู้รับต้องรู้",
      "authorship": "lumei-original-adaptation",
      "supporting_candidate_ids": [
        "H-11",
        "H-32"
      ]
    },
    {
      "action_id": "A2",
      "action": "ตรวจว่ามีผู้รับงานที่ยืนยันและเข้าใจสิ่งที่ต้องทำต่อ พร้อมขอบเขตความรับผิดชอบ",
      "authorship": "lumei-original-adaptation",
      "supporting_candidate_ids": [
        "H-11",
        "H-32"
      ]
    },
    {
      "action_id": "A3",
      "action": "ติดตามข้อตกลงตามจุดที่เหมาะสมและแจ้งอุปสรรคเมื่อพบ แทนถือว่าส่งข้อความแล้วจบ",
      "authorship": "lumei-original-adaptation",
      "supporting_candidate_ids": [
        "H-05"
      ]
    }
  ],
  "evidence_to_look_for": [
    "บันทึกสถานะและงานค้าง",
    "คำตอบของผู้รับและขอบเขตที่ยืนยัน",
    "หลักฐานติดตาม/แจ้งอุปสรรค"
  ],
  "interpretation_limits": [
    "ส่งแล้วไม่เท่ากับรับหรือทำเสร็จ",
    "ไม่สามารถรับรองคุณภาพงานของผู้รับโดยไม่มีข้อมูล",
    "ข้อเสนอการฝึกไม่ใช่หลักฐานว่าผู้ใช้เคยทำหรือทำได้แล้ว",
    "ไม่ให้คะแนน ระดับ proficiency หรือคำตัดสินตัวตนจากเหตุการณ์"
  ],
  "practice": {
    "authorship": "lumei-original-design",
    "optional": true,
    "target": "ระบุสถานะงาน สิ่งที่ทำแล้ว สิ่งที่ยังค้างและข้อมูลที่ผู้รับต้องรู้",
    "user_attempt": "เขียน handoff หนึ่งงาน ระบุสถานะ งานค้างและสิ่งที่ผู้รับต้องยืนยัน โดยไม่ใส่ข้อมูลเกินสิทธิ",
    "feedback_basis": "ผู้รับทำต่อได้จากข้อมูลที่ได้รับหรือไม่; มีผู้รับที่ยืนยันจริงหรือเพียงสมมติชื่อไว้",
    "assistance_boundary": "AI ช่วยจัดโครงหรือชี้ข้อมูลที่ยังขาดได้ ผู้ใช้เป็นเจ้าของเหตุผลและปฏิเสธกิจกรรมได้; ไม่ grading",
    "transfer_to_another_context": "เปลี่ยนจากส่งงานระหว่างทีมเป็นส่งงานระหว่างกะ ระบุข้อมูลสำคัญและวิธีตรวจรับที่ต่าง",
    "evidence_to_collect_next": [
      "บันทึกสถานะและงานค้าง",
      "หลักฐานติดตาม/แจ้งอุปสรรค"
    ],
    "stop_conditions": [
      "ผู้ใช้ไม่ต้องการฝึก",
      "งานเกินสิทธิหรือเสี่ยงกระทบคน/ระบบจริง",
      "ต้องมีผู้รับผิดชอบเฉพาะทางแต่ยังไม่พร้อม"
    ]
  },
  "human_ai_judgment": "ตรวจหลักฐานและสิทธิการใช้ก่อนลงมือ; คง uncertainty; คนที่มีอำนาจจริงรับผิดชอบการตัดสินใจ",
  "coaching_overlay_ids": [
    "agency-and-boundaries"
  ],
  "source_refs": [
    {
      "candidate_id": "H-11",
      "source_id": "HARVARD-FY14",
      "version": "FY14",
      "locator": {
        "type": "pdf",
        "local_path": "Harvard University Competency Dictionary FY14 - final.pdf",
        "pdf_page": 11,
        "section": "Competency definition and Key Actions"
      },
      "review_decision": "include",
      "support_role": "behavior_support",
      "supported_fields": [
        "observable_actions.A1",
        "observable_actions.A2"
      ],
      "supported_claim": "Communicates clearly and listens to others.",
      "adaptation_limits": [
        "Candidate only; observable episode evidence required.",
        "No scoring, levels or unsupported trait inference."
      ]
    },
    {
      "candidate_id": "H-32",
      "source_id": "HARVARD-FY14",
      "version": "FY14",
      "locator": {
        "type": "pdf",
        "local_path": "Harvard University Competency Dictionary FY14 - final.pdf",
        "pdf_page": 32,
        "section": "Competency definition and Key Actions"
      },
      "review_decision": "include",
      "support_role": "behavior_support",
      "supported_fields": [
        "observable_actions.A1",
        "observable_actions.A2"
      ],
      "supported_claim": "Works cooperatively and contributes to shared goals.",
      "adaptation_limits": [
        "Candidate only; observable episode evidence required.",
        "No scoring, levels or unsupported trait inference."
      ]
    },
    {
      "candidate_id": "H-05",
      "source_id": "HARVARD-FY14",
      "version": "FY14",
      "locator": {
        "type": "pdf",
        "local_path": "Harvard University Competency Dictionary FY14 - final.pdf",
        "pdf_page": 5,
        "section": "Competency definition and Key Actions"
      },
      "review_decision": "include",
      "support_role": "behavior_support",
      "supported_fields": [
        "observable_actions.A3"
      ],
      "supported_claim": "Accepts responsibility and follows through on commitments.",
      "adaptation_limits": [
        "Candidate only; observable episode evidence required.",
        "No scoring, levels or unsupported trait inference."
      ]
    },
    {
      "candidate_id": "ICD-M-2962",
      "source_id": "ICD-V4-SKILL",
      "version": "V4 announced 2019-01-21",
      "locator": {
        "type": "xlsx",
        "local_path": "iCDEnglishV4-4layer/Skill Dictionary V4.xlsx",
        "sheet": "Skill List V4",
        "range": "A2962:H2962",
        "row": 2962,
        "skill_code": "S140040030",
        "expected_skill_name": "Knowledge management methods",
        "expected_knowledge_code": "K001",
        "expected_knowledge_name": "Content management (Web publishing tools, Web conferences, Wiki, blogs etc., document preparation, data and financial analysis, presentation tools, flow chart preparation, content management system (systematization, organization, version control, document architecture), publication and distribution)"
      },
      "review_decision": "adapt",
      "support_role": "related_concept_only",
      "supported_fields": [
        "design_notes"
      ],
      "supported_claim": "Named knowledge item in an IT-oriented method family.",
      "adaptation_limits": [
        "Selected pointer, not full method description.",
        "Specialty methods/standards are not compulsory for all workers."
      ]
    }
  ],
  "adaptation_note": "เลือกส่วนที่ใช้ข้ามงานได้จาก candidate ที่ตรวจแล้ว; ข้อความไทย พฤติกรรมเชิงปฏิบัติและกิจกรรมเป็นการประยุกต์ของ Lumei ไม่ใช่คำแปลรับรองหรือมาตรฐานสากล",
  "design_notes": "iCD ที่อ้างเป็นเพียง related concept; NZ เสริมขอบเขต; overlays และ foresight ไม่เป็น episode evidence",
  "distinction": {
    "compared_with": [
      "GWS-manage-priorities"
    ],
    "separation": "priorities เลือกงานและ tradeoffs; handoff ตรวจผู้รับและสถานะความรับผิดชอบ; "
  },
  "manager_branch": {
    "requires_actual_authority": true,
    "note": "หากผู้ใช้มีอำนาจมอบหมายจริง อาจกำหนดความรับผิดชอบและ oversight; contributor ใช้การตกลงกับผู้รับ ไม่สั่งมอบหมาย",
    "source_ref": {
      "candidate_id": "H-15",
      "source_id": "HARVARD-FY14",
      "version": "FY14",
      "locator": {
        "type": "pdf",
        "local_path": "Harvard University Competency Dictionary FY14 - final.pdf",
        "pdf_page": 15,
        "section": "Competency definition and Key Actions"
      },
      "review_decision": "adapt",
      "support_role": "role_conditional_only",
      "supported_fields": [
        "manager_branch"
      ],
      "supported_claim": "Allocates responsibilities and supports completion.",
      "adaptation_limits": [
        "Candidate only; observable episode evidence required.",
        "No scoring, levels or unsupported trait inference."
      ]
    }
  }
}
