{
  "skill_id": "GWS-understand-recipient-needs",
  "editorial_version": "0.2.0",
  "status": "release-candidate",
  "runtime_authority": false,
  "contract_status": "editorial-schema-1.0.0-and-shared-contract-1.0.0-validated",
  "title_th": "เข้าใจผู้รับบริการและตอบในขอบเขตที่ทำได้",
  "title_en": "Understand recipient needs",
  "family_id": "relate-and-coordinate",
  "workplace_situation": "ผู้รับบริการภายในหรือภายนอกแจ้งปัญหาและต้องตกลงการช่วยเหลือที่ทำได้จริง",
  "purpose": "เข้าใจผู้รับบริการและตอบในขอบเขตที่ทำได้จากหลักฐานในเหตุการณ์ โดยคงสิทธิและขอบเขตของผู้ใช้",
  "scope": {
    "applicable_roles": [
      "contributor",
      "manager"
    ],
    "required_managerial_authority": false,
    "work_contexts": [
      "desk",
      "frontline"
    ],
    "boundary_conditions": [
      "ใช้เฉพาะงานและข้อมูลที่ผู้ใช้มีสิทธิ",
      "ไม่แทนขั้นตอนองค์กรหรือความรู้เฉพาะวิชาชีพ",
      "เหตุการณ์คุกคาม ความปลอดภัยหรือความเสี่ยงสูงต้องใช้ช่องทางที่เหมาะสมก่อนกิจกรรมฝึก"
    ]
  },
  "observable_actions": [
    {
      "action_id": "A1",
      "action": "ถามและบันทึกปัญหา ความต้องการ และข้อจำกัดตามที่ผู้รับระบุ แยกจากสิ่งที่ตนเดา",
      "authorship": "lumei-original-adaptation",
      "supporting_candidate_ids": [
        "H-13",
        "H-11"
      ]
    },
    {
      "action_id": "A2",
      "action": "อธิบายสิ่งที่ช่วยได้ สิ่งที่ยังทำไม่ได้ และทางเลือกในขอบเขตสิทธิ โดยไม่รับปากเกินจริง",
      "authorship": "lumei-original-adaptation",
      "supporting_candidate_ids": [
        "H-13"
      ]
    },
    {
      "action_id": "A3",
      "action": "ตรวจกลับว่าการตอบสนองตรงความต้องการที่ตกลงหรือไม่ และบันทึกสิ่งที่ยังต้องตามต่อ",
      "authorship": "lumei-original-adaptation",
      "supporting_candidate_ids": [
        "H-13"
      ]
    }
  ],
  "evidence_to_look_for": [
    "ข้อความถามและคำตอบผู้รับ",
    "ขอบเขตหรือทางเลือกที่แจ้งจริง",
    "feedback และสิ่งที่ยังไม่ยืนยัน"
  ],
  "interpretation_limits": [
    "ผู้รับไม่ได้ตอบไม่เท่ากับพึงพอใจ",
    "ไม่ให้คำมั่นแทนผู้มีอำนาจหรือทดแทนมาตรฐานบริการ",
    "ข้อเสนอฝึกไม่ใช่การกระทำที่เกิดแล้ว; ไม่ให้คะแนนหรือระดับบุคคล"
  ],
  "practice": {
    "authorship": "lumei-original-design",
    "optional": true,
    "target": "ถามและบันทึกปัญหา ความต้องการ และข้อจำกัดตามที่ผู้รับระบุ แยกจากสิ่งที่ตนเดา",
    "user_attempt": "ร่างคำตอบต่อข้อร้องเรียนสมมติหนึ่งเรื่อง ระบุสิ่งที่ช่วยได้และข้อจำกัดโดยไม่รับปากแทนทีม",
    "feedback_basis": "คำตอบอ้างความต้องการที่ผู้รับระบุจริงหรือไม่ และมีการรับปากเกินสิทธิหรือไม่",
    "assistance_boundary": "AI ช่วยจัดโครงหรือชี้ข้อมูลที่ยังขาดได้ ผู้ใช้เป็นเจ้าของเหตุผลและปฏิเสธกิจกรรมได้; ไม่ grading",
    "transfer_to_another_context": "เปลี่ยนจากคำขอฝ่ายภายในเป็นผู้รับบริการหน้างาน ระบุสิทธิและช่องทางที่ต่างกัน",
    "evidence_to_collect_next": [
      "ข้อความถามและคำตอบผู้รับ",
      "feedback และสิ่งที่ยังไม่ยืนยัน"
    ],
    "stop_conditions": [
      "ผู้ใช้ไม่ต้องการฝึก",
      "งานเกินสิทธิหรือเสี่ยงกระทบคน/ระบบจริง",
      "ต้องมีผู้รับผิดชอบเฉพาะทางแต่ยังไม่พร้อม"
    ]
  },
  "human_ai_judgment": "ตรวจหลักฐานและสิทธิการใช้ก่อนลงมือ; คง uncertainty; คนที่มีอำนาจจริงรับผิดชอบการตัดสินใจ",
  "coaching_overlay_ids": [
    "agency-and-boundaries"
  ],
  "source_refs": [
    {
      "candidate_id": "H-13",
      "source_id": "HARVARD-FY14",
      "version": "FY14",
      "locator": {
        "type": "pdf",
        "local_path": "Harvard University Competency Dictionary FY14 - final.pdf",
        "pdf_page": 13,
        "section": "Competency definition and Key Actions"
      },
      "review_decision": "adapt",
      "support_role": "behavior_support",
      "supported_fields": [
        "observable_actions.A1",
        "observable_actions.A2",
        "observable_actions.A3"
      ],
      "supported_claim": "Responds to customer needs and improves service.",
      "adaptation_limits": [
        "Candidate only; observable episode evidence required.",
        "No scoring, levels or unsupported trait inference.",
        "Phase 5: original bounded adaptation from local Key Actions; not a universal standard or legal instruction."
      ]
    },
    {
      "candidate_id": "H-11",
      "source_id": "HARVARD-FY14",
      "version": "FY14",
      "locator": {
        "type": "pdf",
        "local_path": "Harvard University Competency Dictionary FY14 - final.pdf",
        "pdf_page": 11,
        "section": "Competency definition and Key Actions"
      },
      "review_decision": "include",
      "support_role": "behavior_support",
      "supported_fields": [
        "observable_actions.A1"
      ],
      "supported_claim": "Communicates clearly and listens to others.",
      "adaptation_limits": [
        "Candidate only; observable episode evidence required.",
        "No scoring, levels or unsupported trait inference.",
        "Phase 5: original bounded adaptation from local Key Actions; not a universal standard or legal instruction."
      ]
    }
  ],
  "adaptation_note": "Lumei original adaptation; แยก situational actions ออกจาก trait/rating และหน้าที่ที่ต้องมีอำนาจ; ไม่แปลหรือคัดลอก dictionary ทั้งชุด",
  "design_notes": "Phase 5: คัด Key Actions เฉพาะหน้าที่ระบุใน Harvard FY14; activities/transfer เป็น Lumei original design; overlays ไม่เป็น episode evidence",
  "distinction": {
    "compared_with": [
      "GWS-clarify-work",
      "GWS-handoff-and-follow-through"
    ],
    "separation": "recipient needs เน้นผู้รับและความเหมาะสมของการตอบสนอง; clarify เน้นข้อกำหนดงาน; handoff เน้นผู้รับผิดชอบและสถานะส่งต่อ"
  }
}
